title,released year,duration,rating,story line,watch on,watch link
Veer-Zaara,2004,3h 12m,7.8,"""Veer-Zaara"" is a saga of love, separation, courage, and sacrifice. A love story that is an inspiration and will remain a legend forever.",Prime Video,https://www.primevideo.com/detail/amzn1.dv.gti.dcabea89-68d3-de65-1b0b-ca0ccd78b84f
Angamaly Diaries,2017,2h 12m,7.9,"Vincent Pepe who wanted to be a powerful leader of a righteous gang that ruled the city, like his seniors. And then there's the rival clan with the malicious gangsters of Angamaly a locale on which the film is based.",Netflix,https://www.netflix.com/watch/80182447?source=imdb
Vicky Donor,2012,2h 6m,7.8,"A man is brought in by an infertility doctor to supply him with his sperm, where he becomes the biggest sperm donor for his clinic.",MX Player,https://www.mxplayer.in/
Kaththi,2014,2h 46m,8.1,A case of mistaken identity embroils an escaped convict in a fight against a large corporation intent on seizing a village's land.,N/A,N/A
Oopiri,2016,2h 38m,8.0,"Impressed by his carefree attitude, quadriplegic multi-billionaire Vikram hires a convict out on parole as his caretaker. What follows is a string of life lessons they learn from each other.",SunNxt,https://www.sunnxt.com/
Mother India,1957,2h 52m,7.8,"In this melodrama, a poverty-stricken woman raises her sons through many trials and tribulations. But no matter the struggles, she always sticks to her own moral code.",MX Player,https://www.mxplayer.in/
Secret Superstar,2017,2h 30m,7.8,A talented teenage singer-songwriter living amid domestic abuse becomes a YouTube sensation after a video in which she hides her identity goes viral.,Netflix,https://www.netflix.com/watch/80245408?source=imdb
Stanley Ka Dabba,2011,1h 36m,7.8,"A school-teacher, who forces children to share their food with him, forbids one from entering the school until he brings his own Tiffin/Lunch-box.",Hotstar,https://www.hotstar.com/
Thulladha Manamum Thullum,1999,2h 50m,8.3,"Kutty is a good-hearted soul, but unfortunate incidents tend to portray his ruffian side whenever he encounters the girl he loves. A bizarre incident brings them closer and yet keeps them apart.",SunNxt,https://www.sunnxt.com/
Nayak: The Real Hero,2001,3h 7m,7.8,"A man accepts a challenge by the chief minister of Maharashtra to run the state for one day, and makes such a success of it that soon he is embroiled in political intrigue.",Prime Video,https://www.primevideo.com/detail/amzn1.dv.gti.a0b61f6d-8a55-dad7-9892-f21cb5c6f4d5
Rock On!!,2008,2h 25m,7.7,Four friends reunite to relive their moments of glory as a rock band.,Netflix,https://www.netflix.com/watch/70110883?source=imdb
Udta Punjab,2016,2h 28m,7.7,A story that revolves around drug abuse in the affluent north Indian State of Punjab and how the youth there have succumbed to it en-masse resulting in a socio-economic decline.,N/A,N/A
Mimi,2021,2h 12m,7.9,Mimi is introduced by Bhanu to an American couple as a surrogate in exchange for Rs 2 million. She decides to have the baby even when they change their mind and tells her parent that Bhanu is the father.,Netflix,https://www.netflix.com/watch/81267360?source=imdb
Sonchiriya,2019,2h 23m,7.9,"Set in the Chambal valley, the film follows the story of a legion of dreaded, warring dacoits who once terrorized the Indian heartlands.",N/A,N/A
Oru CBI Diary Kurippu,1988,2h 17m,7.8,"Prabhakara Varma is called upon to investigate the death of Omana, the daughter-in-law of a local businessman. It looks like a suicide but, Varma is sure that is not so.",Hotstar,https://www.hotstar.com/
Ayirathil Oruvan,2010,3h 3m,8.0,"Anitha, a government official, embarks on a journey to find Chandramouli, an archaeologist, who went to Vietnam to search for any existence of the prince of the Chola dynasty.",SunNxt,https://www.sunnxt.com/
Badla,2019,1h 58m,7.8,A dynamic young entrepreneur finds herself locked in a hotel room with the corpse of her dead lover. She hires a prestigious lawyer to defend her and they work together to figure out what actually happened.,Netflix,https://www.netflix.com/watch/81112446?source=imdb
Happy Days,2007,2h 33m,7.9,A group of eight youngsters from an engineering college form an unbreakable friendship after going through various struggles.,Prime Video,https://www.primevideo.com/detail/amzn1.dv.gti.36b5eeea-2cb9-e047-3bdc-6c5cbdb5b3ba
Dasvidaniya,2008,1h 53m,7.8,"A man who loves to make ""to-do lists"" makes one last bucket list when he realizes he is about to die.",N/A,N/A
Raazi,2018,2h 18m,7.7,A Kashmiri woman agrees to marry a Pakistani army officer in order to spy on Pakistan during the Indo-Pakistan War of 1971.,Prime Video,https://www.primevideo.com/detail/amzn1.dv.gti.d8b20b27-afaa-29cf-4f42-7c491f05dd77
Kai Po Che,2013,2h,7.8,Three friends growing up in India at the turn of the millennium set out to open a training academy to produce the country's next cricket stars.,Netflix,https://www.netflix.com/watch/70254346?source=imdb
Dia,2020,2h 17m,8.0,"Dia takes three years to confess her feelings to Rohith but after a terrible accident, she is told he does not survive. Later, when she starts seeing Adi, she finds out that Rohith is still alive.",Prime Video,https://www.primevideo.com/detail/amzn1.dv.gti.2cb83b95-aa77-23a5-222f-e4a5a9529a4e
Poove Unakkaga,1996,2h 30m,8.6,"When a man realizes that the Hindu woman he loves is in love with a Christian man, he decides to sacrifice his love and unite their families so as to make the love story a success.",SunNxt,https://www.sunnxt.com/
Minnal Murali,2021,2h 38m,7.8,"An unusual event creates a lightning which in turns gives superhuman abilies to an ambitious tailor ,whose responsibility is now to protect his home village from the evil plans of the antagonist.",Netflix,https://www.netflix.com/watch/81497215?source=imdb
Thiruchitrambalam,2022,2h 11m,7.9,"Thiruchitrambalam lives with his father and grandfather. He blames the former for the loss of his mother and sister and is not on good terms with the latter. Meanwhile, his love life is not so successful.",SunNxt,https://www.sunnxt.com/
Goodachari,2018,2h 27m,7.8,"A young NSA agent is framed for the murder of his bosses making him realize that now his mission is darker than expected and has some personal scores to settle regarding his father's death, a former NSA agent.",Prime Video,https://www.primevideo.com/detail/amzn1.dv.gti.4eb2d44b-94c3-e011-99ce-780c4adc2c50
Joji,2021,1h 53m,7.8,"Joji, an engineering dropout and the youngest son of a rich family lives with his aspirations of becoming super wealthy. Driven by greed and blind ambition, he decides to execute his plans following an unexpected event in the family.",Prime Video,https://www.primevideo.com/detail/amzn1.dv.gti.1cbc43f6-1e93-6b23-edd3-6b60891ce7be
